Id,Url,Heb Date,En Date,Rabby,Title,Question,Answer
15356,https://www.hidabroot.org/question/15356,"כ""ה אדר א' התשע""ד ",25.02.14,"וזכות שמירת שבת כהלכה מועיל למחול לו על כל עונותיו כמ""ש בגמרא כל המשמר שבת כהלכתו אפילו חטא כדור אנוש מוחלין לו שנאמר אשרי אנוש יעשה זאת ובן אדם יחזיק בה שומר שבת מחללו ושומר ידו מעשות כל רע אל תקרי מחללו אלא מחול לו ע""כ העתקתי מדברי הרב הנ""ל.  בברכה – בנימין שמואלי ",אני רוצה לשמור - אבל קשה ! תגיבו אני יכול לסחוב איתי עוד הרבה חברים!,,"שלום וברכה 
כמה גדולה היא מעלת שמירת שבת הנה אמרו חז""ל כל השומר שבת נעשה שותף להקב""ה במעשה בראשית. ומי שמע כזאת שיבא אדם וישתתף בדבר שכבר נגמרה מלאכתו אין אחר מעשה כלום ובמה יעשה שותף עוד מה היא הפעולה הגדולה הזאת שבאמצעותה ישיג השגה זו ועוד לו יהיה שיהיה מעשה זה גדול עד מאוד, מנין להם לומר דבר זה שהוא נעשה שותף וביאר בס` אור החיים כי בשעת הבריאה לא ברא ה` כח בעולם אלא לעמוד ששת ימים וברא יום אחד הוא השבת ובו ביום חוזר ה` ומשפיע נפש לעולם שיעור המקיים עוד ששה ימים וכן על זה הדרך, וזולת זה היום היה העולם חרב בגמר ששת ימים וחוזר לתוהו ובוהו וצריך ה` להכינו פעם ב` ובאמצעות השבת העולם עומד, ומאחר שהשבת הוא המקיים העולם כל ששת הימים, ואחר עבור ששת ימים יבא שבת אחרת ויחייהו ויקיימהו עוד ששת ימים אחרים, ויש לך לדעת כי מציאות השבת בעולם הוא קיומו שמקיימים אותו כי אם אין מקיימים שבת אין שבת, ואם אין שומר, שבת מה זאת עושה. 
ולזה כל השומר את השבת וכו` פירוש מקיים ושומר קדושתו, באמצעות זה ישנו לשבת ובאמצעותו מתקיים העולם, הראת לדעת כי שומר השבת הוא המקיים העולם ואין לך שותף גדול מזה כדין וכהלכה ועוד יש לך לדעת כי מיום בריאת העולם, לא חסר העולם שומר שבת, כי אדם שומר שבת היה ע""ה ואחריו קם שת בנו כי הוא היה צדיק גמור, ואחריו כמה צדיקים וכשזה נופל כבר בא השמש שומר שבת מתושלח וכו` נח שם אברהם וכו`, ומשם לא פסקה שמירת שבת מישראל ואפילו במצרים היו שומרי שבתות כמאמרם ז""ל ונכון: עד כאן דבריו הנעימים . 
עוד אמרו חז""ל אלמלא שמרו ישראל ב` שבתות מיד נגאלים, כי השבת היא מעין עולם הבא, ואם יזכו ישראל לשמור את השבת, וירגישו מעין עוה""ב, מיד יזכו לביאת המשיח ולעולם הבא,ממש. ויש לך לדעת שכשיבוא משיח צדקינו, יראה באצבע, על שומרי השבת, אשר בזכותם נגאלו ישראל. עוד אמרו חז""ל כל השומר שבת כהלכתו אפי` עבד ע""ז מוחלין לו, ושקולה שמירת שבת ככל המצוות , והטעם לכך, הנה שמירת השבת היא הראיה הברורה שהאדם מאמין בבורא אשר יצר הכל בששת ימים ולכן אפי` אם נכשל בחטא אינו כופר בבוראו ולכן מתקבלת תשובתו ומוחלין לו כל עוונותיו, והנה המאמין בבורא בודאי רוצה לקיים את כל המצות ולכן ע""י שמירת שבת המראה את אמונת האדם בבורא יחשב הדבר כאילו קיים את כל התורה. השבת היא מקור הברכה, וכל השפע של כל השבוע, נמשך ע""י השבת, ולא ירויח האדם מאומה מחילול שבת, וכידוע. 
השבת היא האות שאנחנו עם ה`, וככתוב בתורה `ביני ובין בני ישראל אות היא לעולם`. עוד אמרו חז""ל התנה הקב""ה עם אברהם, שבזכות מילה ושבת, אין בניו יורדים לגיהנם. עוד אמרו חז""ל שאפי` הגיהנם שובת בשבת, וידוע שסיאנסים אינם יכולים ליעשות בשבת, מכיוון שאף הרשעים נחים בשבת. ואעתיק לך את דברי הרב בעל המשנה ברורה והחפץ חיים המבאר את גודל המעלה של השבת כתוב בתורה זכור את יום השבת לקדשו ששת ימים תעבוד וגו` כי ששת ימים עשה ד` את השמים ואת הארץ וגו` הורה לנו ה` בפסוק זה שעניין השבת הוא שורש האמונה לידע שהעולם הוא מחודש ונברא ולא נעשה מעצמו וכיון שה` ברא הכול הוא האדון על הכול ואנחנו עבדיו ומחוייבים לעשות רצונו ולעבדו בכל גופינו ונשמותינו וממונינו כי הכול שלו והזהירה התורה על שמירת השבת י""ב פעמים ואמרו חז""ל כל המשמר את השבת כאלו מקיים כל התורה וכל המחלל השבת כאלו כפר בכל התורה כולה והכול מהטעם שהשבת היא שורש האמונה: וכעין זה כתוב ג""כ במדרש א""ר אלעזר בר אבינא אמר הקב""ה לישראל אם תזכו לשמור שבת מעלה אני עליהם כאלו שמרתם כל מצות שבתורה ואם חיללתם אותו מעלה אני עליכם כאלו חיללתם כל המצות וכן הוא אומר שומר שבת מחללו ושומר ידו מעשות כל רע וכו` דהיינו שההיפך משמירת שבת היא עשיית כל רע. וראי את חומר העוון שיש באיסור חילול שבת דהלא ידוע שיש כמה חלקי עונשים על העונות יש עניינים שכשהאדם עובר עליהן הוא רק איסור עשה בלבד חמור מזה העונות שיש עליהן איסור לאו חמור מזה העונות שיש עליהן מיתה בידי שמים חמור מזה העונות שיש עליהן עונש כרת חמור מזה אותן שיש עליהן מיתה בידי אדם והוא מיתת חנק למעלה מזה אותן שעונשן הוא הרג בסייף למעלה מזה אותן שמיתתן בשרפה למעלה מכולם אותן שמיתתן בסקילה כי היא החמורה שבמיתות ועל עוון חילול שבת במזיד הלא מיתתו הוא בסקילה. וגם עונש מחלל שבת הוא בסקילה כעובד כוכבים וכשהוא בלי התראה הוא עכ""פ בכרת מכל זה יוכל האדם לראות את גודל הענין של שבת וכן יש עוד כמה מאמרי חז""ל המפליגים מאד בעון חילול שבת. וז""ל הרמב""ם פ""ל מהלכות שבת, השבת ועבודת כוכבים כל אחת משתיהן שקולה כנגד שאר כל מצות התורה והשבת הוא האות שבין הקב""ה ובינינו לעולם לפיכך כל העובר על שאר המצות הרי הוא בכלל רשעי ישראל אבל המחלל שבת בפרהסיא הרי הוא כעובד עבודת כוכבים ושניהם כעובדי כוכבים לכל דבריהם וכו` ע""ש. וגם צריך לדעת הרמ""ח מצוות עשה שבתורה שהטיל ה` על האדם לזוכרם ולשמרם הוא נגד הרמ""ח אברים שבאדם וכמו שישנם איברים שונים יש מהם שאין הנשמה תלויה בהם כמו היד והרגל וכדומה שאפילו אם יחסרו אף שההפסד הוא רב מאוד מאוד אעפ""כ נקרא רק בשם בעל מום ויש שע""י חסרונותיו אינו יכול לחיות על פני תבל כגון שניתז ראשו או שנקרע סגור לבו ששם הוא מקור החיים. כך הוא ג""כ בענייני המצוות שעליהן כתוב אשר יעשה האדם וחי בהם ונאמר כי היא חייך ואורך ימיך ועוד פסוקים הרבה כהנה המורים לנו כי עיקר חיי הנפש לעוה""ב תלוי בקיום התורה יש מצוות שאפילו אם פשע האדם ועבר עליהם הוא נקרא לעוה""ב רק בשם בעל מום וגם זה גנאי גדול הוא לנצח דידוע מה שכתב הרח""ו בשער הקדושה שהחבלה תימצא לנצח בנפשו באותו האבר שפשע בו על רצון ה` ונמצא שאם לא הניח תפילין אף אם יקיים האדם את כל המצוות יהיה בעל מום בידו ונמצא כשיקום לעת התחייה כל ישראל יעמדו חיים וקיימים בכל אבריהם והוא יהיה בעל מום ביד השמאלי הזה לנצח שרק בזכות מצות התורה שאדם מקיים באבריו הם זוכים לחיות לעתיד חיי עולם וכל מצוה שברמ""ח מצות מחיה את האבר שברמ""ח השייך לו וכמו שאנו אומרים וחיי עולם נטע בתוכנו וכיון שעבר בשאט נפש על המצווה ההיא אין לו מי שיחיה את האבר ההוא וכמה יתמרמר אח""כ האדם ההוא ע""ז שהכל ידעו את גודל המרותו בד` במצות תפילין. 
וכן אם יהיה בעל מום בשאר איברים ע""י שארי דברים שקלקל וכמו שכתוב בתרגום קהלת על הפסוק סוף דבר הכול נשמע דהיינו שלבסוף הכול יתפרסם לעיני כל ולכן את האלוהים ירא ואת מצותיו שמור כי זה כל האדם ורצה לומר שמהרמ""ח מצוות עשה ושס""ה מצוות לא תעשה שנשמר האדם בימי חייו יבנה לעתיד כל האדם ונמצא כשיקום ויהיה בעל מום באיזה אבר או שיתקלקל לו איזה גיד מגידיו [המכונים נגד שס""ה לאוין שבתורה] יתבוננו הכל איזה מצות עשה או לא תעשה עבר בשאט נפש וכמה קלון וכלימה יסבול עי""ז לנצח. ויש ענינים שהם נגד הראש והלב שהם עיקר חיות נפש הקדושה כמו אמונה בד` ובתורתו וענין שמירת שבת דהוא ג""כ יסוד האמונה שאם יחסר לו עניינים ההם כבר נסתלק כל עיקר החיות מנפשו הקדושה וכשהוא חי בעוה""ז הוא חי רק בנפש הבהמית שלו ולא יהיה לו במה להקים בעת התחיה. 
וזכות שמירת שבת כהלכה מועיל למחול לו על כל עונותיו כמ""ש בגמרא כל המשמר שבת כהלכתו אפילו חטא כדור אנוש מוחלין לו שנאמר אשרי אנוש יעשה זאת ובן אדם יחזיק בה שומר שבת מחללו ושומר ידו מעשות כל רע אל תקרי מחללו אלא מחול לו ע""כ העתקתי מדברי הרב הנ""ל.  בברכה – בנימין שמואלי "
15221,https://www.hidabroot.org/question/15221,"כ""ה אדר א' התשע""ד ",25.02.14,2. לא בברכה - בנימין שמואלי ,האם לגעת בכלב שלי בשבת זה נחשב לגעת במוקצה ,,"שלום וברכה 
זה נחשב לנגיעה במוקצה, שאסורה שלא לצורך האדם, ויש מתירין כל נגיעה במוקצה שאינה מביאה להזזת המוקצה. טילטול הכלב אסורה בהחלט. 
2. לא בברכה - בנימין שמואלי "
15227,https://www.hidabroot.org/question/15227,"כ""ה אדר א' התשע""ד ",25.02.14,בברכה - בנימין שמואלי ,האם חייבים לעשות המוציא בסעודה שלישית,,"שלום וברכה 
לכתחילה יש לאכול פת, ואם אינו יכול לאכול לחם יכול לקיימם בעוגות או בפירות. 
בברכה - בנימין שמואלי "
15230,https://www.hidabroot.org/question/15230,"כ""ה אדר א' התשע""ד ",25.02.14,"בקיצור ממתינים על הסדרה הבינונית של הכוכבים, ומשיצאו שלשה בינוניים, אפשר לקבוע כי ממשלת היום פינתה את מקומה לממשלת הלילה. בהצלחה - מנשה ישראל ","כמה כוכבים חיפשו בעבר בשמי ירושליים, כדי להיות בטוחים שהשבת יצאה?",,"כך כתוב בתלמוד (שבת לה ע""ב) וכך גם נפסק בהלכה: ""אמר רב יהודה אמר שמואל, כוכב אחד - יום, שנים - בין השמשות, שלשה - לילה, תניא נמי הכי, כוכב אחד - יום, שנים - בין השמשות, שלשה - לילה. אמר רבי יוסי לא כוכבים גדולים הנראין ביום ולא כוכבים קטנים שאין נראין אלא בלילה אלא בינונים"". 
בקיצור ממתינים על הסדרה הבינונית של הכוכבים, ומשיצאו שלשה בינוניים, אפשר לקבוע כי ממשלת היום פינתה את מקומה לממשלת הלילה. בהצלחה - מנשה ישראל "
15237,https://www.hidabroot.org/question/15237,"כ""ה אדר א' התשע""ד ",25.02.14,בהצלחה - מנשה ישראל ,האם מותר לי להתאפר בכניסת שבת ,,"שלום וברכה 
א. לפני הדלקת נרות שבת מותר להתאפר, בשעת הצורך אפשר לאחר את הדלקת הנרות עד אחרי עשר דקות מהזמן הכתוב בלוח. 
ב. מרן הרב עובדיה שליט""א מתיר. 
ג. בשבת מתפללים על דברים הקשורים ברוחניות, לפני יהיו לרצון בסיום השמונה עשרה. 
ד. אני משער שלא כיוונת להגיד ששיר השירים הוא שיר אהבה בין איש לאשתו, כי פשוט הדבר ששיר השירים אינו שיר אהבה בין איש לאשתו חס ושלום, אי אפשר להעלות על המחשבה שבני ישראל ינבלו את פיהם ברגעים היותר חשובים בשנה בשירי עגבים חס ושלום. 
גם סברה זאת יצאה מבית תיפלתם של מלמדי המקרא בבתי הספר החילוניים שטוב היה שתיקתם מדיבורם, ולוואי שיפסיקו ללמוד את התנ""ך בכלל מאשר ללמד תנך בצורה מעוותת. שיר קודש זה הוא המעולה מכל השירים ששרו בני ישראל לאביהם שבשמים, ומכיון שתוקף האהבה הגשמית נמצאת בין איש לאשתו השכיל שלמה החכם מכל האדם לסדר את דברי השיר להקב""ה כצורה של שיר אהבה, אבל כל מילה רומזת לפנים עמוקים מאוד, וגם הפשט בשיר השירים אינו כפשוטו. 
וכך מקדים בעל אבן עזרא לפירושו על ספר זה: ""זה הספר נכבד וכולו מחמדים ואין בכל שירי שלמה המלך חמשה ואלף כמוהו על כן כתוב שיר השירים אשר לשלמה כי זה השיר מעול` מכל השירים אשר לשלמה ובו סוד סתום וחתום כי החל מימי אברהם אבינו עד ימות המשיח וכן כתב בשירת האזינו בהנחל עליון גוים החל מן דור הפלגה עד שוב ישראל מהגלות אחר מלחמת גוג ומגוג"". 
""ואל תתמה בעבור שהמשיל כנסת ישראל לכלה והמקום דודה כי כן דרך הנביאים ישעיה אמר שירת דודי לכרמו ועוד כמשוש חתן על כלה יחזקאל אמר שדים נכונו ושערך צמח ואת ערום ועריה ועוד אכסה ערותך ואעדך עדי וכל הפרשה כולה הושע אמר וארשתיך לי לעולם לך אהב אשה ובספר תהלות משכיל שיר ידידות וכתוב בו שמעי בת וראי והטי אזנך, וחלילה חלילה להיות שיר השירים בדברי חשק כי אם על דרך משל ולולי גודל מעלתו לא נכתב בסוד כתבי הקודש"". 
רבי עקיבא היה קורא את שיר השירים כשהוא בוכה ומשתפך בדמעות שליש מכיון שהשיג את עומק הסודות שיש בשיר זה. הוא היה אומר כי היום החשוב ביותר מכל שנות עולם הוא היום שבו ניתנה שיר זה לעם ישראל. וכל העולם כולו על כל מעשיו החיובים אינו ראוי לקבל מתנה כזאת. 
הפשט בפסוק שציטטת היא כפי שפירשו חז""ל שזהו רמז על שני השדיים המניקים של עם ישראל הלא הם משה ואהרן שהניקו חלב של תורה לעם ישראל אחרי מעמד הר סיני. רצוי וראוי וכמעט חיוב למי שרוצה להגיד שיר השירים שינקה מקודם את הראש מכל מה שפטפטו סביב שיר זה בבתי הספר, ולהתבונן בפירוש רש""י על שיר השירים או פירוש אחר מחכמי ישראל, ורק כך אפשר להגיד שיר זה כראוי. ה. לא ראוי להסתכל בתמונה. 
בהצלחה - מנשה ישראל "
15201,https://www.hidabroot.org/question/15201,"כ""ה אדר א' התשע""ד ",25.02.14,בברכה - בנימין שמואלי ,טלטול בשבת מה הכוונה?,,"שלום וברכה 
אחת ממלאכות שבת היא איסור ההוצאה מרשות היחיד לרשות הרבים. כיום ברוב הישובים, יש עירוב, מושג הלכתי אשר הופך את הרחוב לרשות היחיד לדעת האשכנזים. 
לדעת הרבה מגדולי הספרדים אין הדבר מועיל ואסור להוציא כלום מהבית לרחוב. 
בברכה - בנימין שמואלי "
15119,https://www.hidabroot.org/question/15119,"כ""ה אדר א' התשע""ד ",25.02.14,חזקי ואמצי - עלי והתעלי - בנימין שמואלי ,חפיפת השיער ביום שבת  האם מותר ,,"שלום וברכה 
אשרייך שזכית לשמור את השבת, ולהקפיד על כל ההלכות כמו שצריך. אסור לרחוץ במים חמים בשבת בכל אופן. שימוש במים חמים לכל צורך שהוא אסור בשבת אלא אם כן המים מדוד שמש שבה יש מקום להקל. 
וגם ברחיצה בצונן אסור לסחוט את השיער. ועל כן אין לחפוף בשבת, ויש להמתין עד מוצאי שבת. גדולה שמירת שבת שבכוחה לכפר עוון, ואלמלא שמרו ישראל שני שבתות מיד נגאלין. 
חזקי ואמצי - עלי והתעלי - בנימין שמואלי "
15141,https://www.hidabroot.org/question/15141,"כ""ה אדר א' התשע""ד ",25.02.14,בברכה - בנימין שמואלי ,האם יש איסור ללבוש מכנסי גי`נס,,"שלום וברכה 
כך אמרו חכמים על הפסוק (1) ספר ישעיה פרק נח (יג) אִם תָּשִׁיב מִשַּׁבָּת רַגְלֶךָ עֲשׂוֹת חֲפָצֶיךָ בְּיוֹם קָדְשִׁי וְקָרָאתָ לַשַּׁבָּת עֹנֶג לִקְדוֹשׁ יְהֹוָה מְכֻבָּד ""וְכִבַּדְתּוֹ"" מֵעֲשׂוֹת דְּרָכֶיךָ מִמְּצוֹא חֶפְצְךָ וְדַבֵּר דָּבָר: (יד) אָז תִּתְעַנַּג עַל יְהֹוָה וְהִרְכַּבְתִּיךָ עַל בָּמֳותֵי \{בָּמֳתֵי\} אָרֶץ וְהַאֲכַלְתִּיךָ נַחֲלַת יַעֲקֹב אָבִיךָ כִּי פִּי יְהֹוָה דִּבֵּר: וכבדתו שלא יהיה מלבוש של שבת כמלבושו של חול, ויש לכבד את השבת בבגדים מיוחדים וככל שמרגישים את קדושת השבת כן מכבדים אותה יותר. אין כל איסור בלבוש כל שהוא בשבת. 
בברכה - בנימין שמואלי "
15144,https://www.hidabroot.org/question/15144,"כ""ה אדר א' התשע""ד ",25.02.14,"ב. מנהג ישראל לאפות בבתיהם לחמים לכבוד שבת [ולשים עיסה בשיעור של קילו ושש מאות גרם, בכדי שיהיה שיעור להפרשת חלה בברכהן], כרי שתקיים האשה מצות הפרשת חלה, כי האדם הראשון נברא בע""ש והיה חלתו של עולם, והאשה בחטאה אבדתו, וע""כ צריכה היא לתקן דבר זה. >בהצלחה - מנשה ישראל ", ערוב תבשילין + חלת שבת,,"שלום וברכה 
א. עֵרוּב תבשילין: חל יום חג בערב שבת [פסח, שבועות, סוכות, שמחת תורה, ראש השנה], צריך לעשות `ערוב תבשילין` בערב החג, שהוא יום ד`, או יום ה`, קודם חשכה, ובזה יהא מותר להכין ביום שני של חג צרכי שבת: וענין הערוב הוא, לפי שאסרו חכמים לבשל מיום טוב לשבת, כדי שלא יבוא לבשל מיום טוב לחול. אבל אם הכין מערב יום טוב תבשיל לשבת - מותר, לפי שנעשה כאילו התחיל כבר לבשל מערב יום טוב לשבת, ועכשָׁו אינו אלא גומר מלאכתו, ובזה יהא לו הֶכר, שיאמר: ומה מיום טוב לשבת אסור לבשל - קל וחומר מיום טוב לחול שאסור לבשל. 
ולכך נקרא `עֵרוב` - שמערב בישולו לצורך שבת בבישולו לצורך יום טוב והכל נעשה בישול אחד: ערוב זה עושים בפת ותבשיל: בערב החג קודם שקדש היום, לוקח בידו חלה אחת, או מצות שתים (כדי שיהא בהן שיעור כביצה) ונותן עם החלה או עם המצות לפחות כזית מדבר מבושל - בשר, דגים או ביצה שלוקה או צלויה וכיוצא באלו, ומברך: `אשר קדשנו במצוותיו וצִוָּנו על מצוַת עֵרוב`: ואף על פי שמצוה זו אינה אלא מדברי חכמים, מברכים `וצִונו` לפי שהקדוש ברוך הוא צונו בתורתו לשמוע בקול חכמים כמה שנאמר (דברים יז): לֹא תָסוּר מִן הַדָּבָר אֲשֶׁר יַגִּידוּ לְךָ יָמִין וּשְׂמֹאל. 
וזה הטעם בכל המצוות שהן מתקנת חכמים ומברכים עליהן `וצִונו`: אחרי הברכה אומרים: `בזה הערוב יהא מותר לנו לאפות ולבשל ולהטמין ולהדליק נר (מנר דלוק. שאין מולידין אש ביום טוב) ולעשות כל צרכינו מיום טוב לשבת`, ומצניעין אותו להיות קיָּם עד תחילת שבת. והמנהג שלוקחין את החלה או את המצות של הערוב ל`לחם משנה` של סעודת שבת. הואיל שנעשתה בפת זו מצוה אחת, תֵּעשה בה גם מצוה אחרת: 
ב. מנהג ישראל לאפות בבתיהם לחמים לכבוד שבת [ולשים עיסה בשיעור של קילו ושש מאות גרם, בכדי שיהיה שיעור להפרשת חלה בברכהן], כרי שתקיים האשה מצות הפרשת חלה, כי האדם הראשון נברא בע""ש והיה חלתו של עולם, והאשה בחטאה אבדתו, וע""כ צריכה היא לתקן דבר זה. >בהצלחה - מנשה ישראל "
15147,https://www.hidabroot.org/question/15147,"כ""ה אדר א' התשע""ד ",25.02.14,תודה על המחמאות עלי והצליחי - מנשה ישראל ,"יין של הבדלה:""",,"שלום וברכה 
השמועה מבוססת, אלא אם כן האשה עושה הבדלה בעצמה כשאין גבר שיבדיל. 
תודה על המחמאות עלי והצליחי - מנשה ישראל "
15079,https://www.hidabroot.org/question/15079,"כ""ה אדר א' התשע""ד ",25.02.14,בברכה - בנימין שמואלי ,מאה ברכות בשבת.,,"שלום וברכה 
אכן חובה לברך על פירות ומזונות בסוף הסעודה על ירקות אין לברך. 
בברכה - בנימין שמואלי "
15024,https://www.hidabroot.org/question/15024,"כ""ה אדר א' התשע""ד ",25.02.14,בברכה - בנימין שמואלי ,הדלקת נרות שבת,,"שלום וברכה 
אין להזיז את הצלחת. קליפות תפוחים שראום לאכליה אינם מוקצה, קליפות שאינם ראוות לאכילה הינם מוקצה. 
בברכה - בנימין שמואלי "
